{
  "schema_version": "1.0",
  "scenario": "promotional_display",
  "contract": {
    "source_file": "核销资料-诚成26年4月【堆头20家】/诚成4月堆头陈列-经销商签订促销合同.pdf",
    "customer_name": "东莞市诚成行供应链管理有限公司",
    "activity_start": "2026-04-01",
    "activity_end": "2026-04-30",
    "display_standard": "20家店*1平米堆头或4纵陈列*1000元/家",
    "fee_per_store": 1000,
    "claimed_amount": 20000,
    "seal_visible": true,
    "stores": [
      {
        "line_no": 1,
        "store_name": "66广场家家欣",
        "address": null
      },
      {
        "line_no": 2,
        "store_name": "百佳华松岗店",
        "address": null
      },
      {
        "line_no": 3,
        "store_name": "百佳华百货（公明店）",
        "address": null
      },
      {
        "line_no": 4,
        "store_name": "百佳华佳漾汇(新桥店)",
        "address": null
      },
      {
        "line_no": 5,
        "store_name": "华都超市(东坑大道北店)",
        "address": null
      },
      {
        "line_no": 6,
        "store_name": "金大福(东浦金正和总店)",
        "address": null
      },
      {
        "line_no": 7,
        "store_name": "古原千禧(U·ONE 优城店)",
        "address": null
      },
      {
        "line_no": 8,
        "store_name": "虎门家家欣",
        "address": null
      },
      {
        "line_no": 9,
        "store_name": "花都宜多",
        "address": null
      },
      {
        "line_no": 10,
        "store_name": "挺拇指生活超市(横沥店)",
        "address": null
      },
      {
        "line_no": 11,
        "store_name": "人人购物广场荟和二店",
        "address": null
      },
      {
        "line_no": 12,
        "store_name": "三乐购物广场(森扬商业广场店)",
        "address": null
      },
      {
        "line_no": 13,
        "store_name": "沙井九龙",
        "address": null
      },
      {
        "line_no": 14,
        "store_name": "润家连锁超市(美联购物中心店)",
        "address": null
      },
      {
        "line_no": 15,
        "store_name": "百佳华(石岩店)",
        "address": null
      },
      {
        "line_no": 16,
        "store_name": "田心金正和",
        "address": null
      },
      {
        "line_no": 17,
        "store_name": "荟和超市(莹展荟店)",
        "address": null
      },
      {
        "line_no": 18,
        "store_name": "三乐购物广场(坦洲店)",
        "address": null
      },
      {
        "line_no": 19,
        "store_name": "大康惠福源商业广场",
        "address": null
      },
      {
        "line_no": 20,
        "store_name": "好多宝精选超市(龙眼市场店)",
        "address": null
      }
    ],
    "notes": [
      "合同PDF第1页为扫描件《经销商签订促销合同》；签订方为东莞市诚成行供应链管理有限公司，活动预算20,000元，执行周期为2026-04-01至2026-04-30，并有可见红色公司印章及2026-03-30日期。",
      "合同第1页编号1至20为完整门店清单；合同未列门店地址。",
      "合同第1页列明涉及产品为“参半所有系列”；活动结束后须提供真实有效凭证，示例包括发票、小票、照片、POS数据等；活动结束后15个工作日内提交核销申请，收到申请后10个工作日内完成审核与费用结算。",
      "PDF第2页《市场费用结算单》致厦门参半商贸有限公司，重复列示2026-04-01至2026-04-30期间20个堆头、1,000元/堆头、合计20,000元；页面有可见印章，日期为2026-05-15。",
      "结算单注明核销费用只能用于货补下单；若双方终止合作，剩余未使用费用清零。",
      "PDF第3至4页为带可见印章的客户级销售明细，期间相同，列示总数量13,744、合计金额352,032，但无门店字段。"
    ]
  },
  "photo_reviews": [
    {
      "store_line_no": 1,
      "contract_store_name": "66广场家家欣",
      "photo_files": [
        "1.厚街汉邦66广场家家欣.jpg"
      ],
      "visible_date": "2026-04-30",
      "visible_location": "广东省东莞市厚街镇汉邦广场",
      "period_match": "match",
      "store_match": "filename_only",
      "display_match": "pass",
      "duplicate_check": "none",
      "mapping_basis": "照片由文件名路由。可见水印独立显示“广东省东莞市厚街镇汉邦广场”，但画面内无门店招牌，亦无地址或更名材料将该地点关联至合同第1行“66广场家家欣”。",
      "risk_notes": [
        "陈列观察：可见完整多层岛柜/端架及大量参半产品，画面支持1平方米堆头或4纵陈列的替代标准。",
        "文件指纹 1.厚街汉邦66广场家家欣.jpg：1279×1706 JPEG；SHA-256 2bc5b681403c0d0e05ba6394449fd73b18e211370dbdfc3b1e3166678fb33aad；64位pHash bc40623f5dbacec0；64位dHash 579da53634371ff4；在21张提交照片中的相同SHA-256出现次数=1。",
        "图像元数据限制：EXIF标签数为0；无嵌入式EXIF日期、GPS、设备或相机信息。采用的日期和地点均为像素内可见水印，未得到独立认证。",
        "合同门店身份仅由文件名提供；可见地点未出现“家家欣”或“66广场”。"
      ],
      "supplement_advice": [
        "补充活动期内可见“66广场家家欣”门店身份的照片，或提供汉邦广场与合同门店之间的权威地址/更名映射。"
      ]
    },
    {
      "store_line_no": 2,
      "contract_store_name": "百佳华松岗店",
      "photo_files": [
        "2.松岗百佳华.jpg"
      ],
      "visible_date": "2026-04-30",
      "visible_location": "深圳市·百佳华超市(松岗百佳华商场店)",
      "period_match": "match",
      "store_match": "exact",
      "display_match": "pass",
      "duplicate_check": "none",
      "mapping_basis": "可见水印同时出现百佳华超市和松岗分店信息，与合同第2行一致；文件名仅用于路由。",
      "risk_notes": [
        "陈列观察：可见宽幅多层参半陈列，至少具备4个纵向层级/排面。",
        "文件指纹 2.松岗百佳华.jpg：3024×3759 JPEG；SHA-256 12b86e89b2996c4ee22ce55cfa65249237f10c2651963f0a74d6748f6fbdf29f；64位pHash d45ed0c3d0cf9847；64位dHash 98342424a034c098；在21张提交照片中的相同SHA-256出现次数=1。",
        "图像元数据限制：EXIF标签数为0；无嵌入式EXIF日期、GPS、设备或相机信息。采用的日期和地点均为像素内可见水印，未得到独立认证。"
      ],
      "supplement_advice": []
    },
    {
      "store_line_no": 3,
      "contract_store_name": "百佳华百货（公明店）",
      "photo_files": [
        "3.公明百佳华.jpg"
      ],
      "visible_date": "2026-04-30",
      "visible_location": "深圳市·百佳华佳漾邻(公明店)",
      "period_match": "match",
      "store_match": "compatible",
      "display_match": "pass",
      "duplicate_check": "none",
      "mapping_basis": "可见水印独立匹配百佳华品牌和公明分店；“百货”与“佳漾邻”按同分店业态/名称变体处理。",
      "risk_notes": [
        "陈列观察：完整端架可见，参半礼盒呈四个纵向货架层级。",
        "文件指纹 3.公明百佳华.jpg：1279×1706 JPEG；SHA-256 334f7fe95b8f70a59cf89c0e2b65a47ba1a19c70d8b1695a51ecd59bdce07463；64位pHash d909f0b5cd483c73；64位dHash 929393f35a2e0194；在21张提交照片中的相同SHA-256出现次数=1。",
        "图像元数据限制：EXIF标签数为0；无嵌入式EXIF日期、GPS、设备或相机信息。采用的日期和地点均为像素内可见水印，未得到独立认证。",
        "未提供百佳华百货与百佳华佳漾邻名称变体的映射材料。"
      ],
      "supplement_advice": [
        "如政策要求精确店名证明，请补充分店名称或更名映射。"
      ]
    },
    {
      "store_line_no": 4,
      "contract_store_name": "百佳华佳漾汇(新桥店)",
      "photo_files": [
        "4.新桥百佳华.jpg"
      ],
      "visible_date": "2026-04-30",
      "visible_location": "深圳市宝安区新桥街道·百佳华佳漾汇(新桥店)",
      "period_match": "match",
      "store_match": "exact",
      "display_match": "pass",
      "duplicate_check": "none",
      "mapping_basis": "可见水印明确显示百佳华佳漾汇(新桥店)，与合同第4行一致。",
      "risk_notes": [
        "陈列观察：完整窄型端架可见，参半产品超过四个纵向陈列层级。",
        "文件指纹 4.新桥百佳华.jpg：600×800 JPEG；SHA-256 df7c36d02303fc3b8df13e63888d0dcfed56860ca91d2a86501f67168d32c3ff；64位pHash d21e05732f4ee5c4；64位dHash 7cb8b479199d84c6；在21张提交照片中的相同SHA-256出现次数=1。",
        "图像元数据限制：EXIF标签数为0；无嵌入式EXIF日期、GPS、设备或相机信息。采用的日期和地点均为像素内可见水印，未得到独立认证。",
        "600×800为本批次最低分辨率之一，细节复核能力受限。"
      ],
      "supplement_advice": []
    },
    {
      "store_line_no": 5,
      "contract_store_name": "华都超市(东坑大道北店)",
      "photo_files": [
        "5.华都超市(东坑大道北店).jpg"
      ],
      "visible_date": "2026-04-02",
      "visible_location": "东莞市·华都超市(东坑大道北店)",
      "period_match": "match",
      "store_match": "exact",
      "display_match": "pass",
      "duplicate_check": "none",
      "mapping_basis": "可见水印与合同门店“华都超市(东坑大道北店)”一致。",
      "risk_notes": [
        "陈列观察：可见完整多层独立陈列架，参半产品占主要位置。",
        "文件指纹 5.华都超市(东坑大道北店).jpg：1081×1440 JPEG；SHA-256 61e7f18669fe68e0686638d9bf53e6e488e8ce9ccb78192cdb6647915337dad0；64位pHash bb17807f857c84c9；64位dHash 484a6a6c512b2b9b；在21张提交照片中的相同SHA-256出现次数=1。",
        "图像元数据限制：EXIF标签数为0；无嵌入式EXIF日期、GPS、设备或相机信息。采用的日期和地点均为像素内可见水印，未得到独立认证。"
      ],
      "supplement_advice": []
    },
    {
      "store_line_no": 6,
      "contract_store_name": "金大福(东浦金正和总店)",
      "photo_files": [
        "6.东浦金正和.jpg"
      ],
      "visible_date": null,
      "visible_location": null,
      "period_match": "unverifiable",
      "store_match": "filename_only",
      "display_match": "uncertain",
      "duplicate_check": "none",
      "mapping_basis": "仅文件名提示“东浦金正和”；像素内无可见日期、地点水印、门店招牌或其他独立门店身份。",
      "risk_notes": [
        "陈列观察：小型促销台上仅清楚显示横向3盒、纵向2层参半礼盒；无法确认1平方米占地或4个纵向层级/排面。",
        "文件指纹 6.东浦金正和.jpg：1080×1920 JPEG；SHA-256 5443f87d47fe6646e5da357f0e53a41c8934f58255619fe749eae9b7ad9596a0；64位pHash dfc1434a3552174f；64位dHash e1f1f03c35693133；在21张提交照片中的相同SHA-256出现次数=1。",
        "图像元数据限制：EXIF标签数为0；无嵌入式EXIF日期、GPS、设备或相机信息。",
        "活动日期和合同门店身份无法由照片验证。",
        "合同要求的陈列标准未完整显示。"
      ],
      "supplement_advice": [
        "补充带有可见日期及门店/地点身份的活动期原图。",
        "补充能够完整展示1平方米堆头或至少4个纵向陈列层级/排面的广角照片。"
      ]
    },
    {
      "store_line_no": 7,
      "contract_store_name": "古原千禧(U·ONE 优城店)",
      "photo_files": [
        "7.宝安优城店.jpg"
      ],
      "visible_date": "2026-04-03",
      "visible_location": "深圳市·古原千禧(优城店)",
      "period_match": "match",
      "store_match": "exact",
      "display_match": "pass",
      "duplicate_check": "none",
      "mapping_basis": "可见水印显示古原千禧(优城店)，与合同中的古原千禧(U·ONE 优城店)一致。",
      "risk_notes": [
        "陈列观察：完整多层岛柜/端架及大量参半产品可见。",
        "文件指纹 7.宝安优城店.jpg：1081×1440 JPEG；SHA-256 80ff9c92a5eb1b780e9b0002a5d99c5239d71f592406992133c1e49e77e5834f；64位pHash d04ea67a36654e71；64位dHash 68a8e08498819e9c；在21张提交照片中的相同SHA-256出现次数=1。",
        "图像元数据限制：EXIF标签数为0；无嵌入式EXIF日期、GPS、设备或相机信息。采用的日期和地点均为像素内可见水印，未得到独立认证。"
      ],
      "supplement_advice": []
    },
    {
      "store_line_no": 8,
      "contract_store_name": "虎门家家欣",
      "photo_files": [
        "8.虎门赤岗家家欣.jpg"
      ],
      "visible_date": "2026-04-30",
      "visible_location": "东莞市·赤岗家家欣商场",
      "period_match": "match",
      "store_match": "compatible",
      "display_match": "pass",
      "duplicate_check": "none",
      "mapping_basis": "可见水印显示赤岗家家欣商场，按合同较概括的“虎门家家欣”之具体分店名称处理。",
      "risk_notes": [
        "陈列观察：完整端架显示五个纵向参半礼盒层级。",
        "文件指纹 8.虎门赤岗家家欣.jpg：600×800 JPEG；SHA-256 a397af48c29cc108f54a66ac21d7aec414e79f20838ee3bb2e4851619d1f9e0a；64位pHash 8d45457f6421a5bd；64位dHash d2f0c6ba371b3ba3；在21张提交照片中的相同SHA-256出现次数=1。",
        "图像元数据限制：EXIF标签数为0；无嵌入式EXIF日期、GPS、设备或相机信息。采用的日期和地点均为像素内可见水印，未得到独立认证。",
        "未提供赤岗家家欣商场与合同第8行虎门家家欣的地址映射。",
        "600×800图像限制细节复核，但水印和陈列仍可辨识。"
      ],
      "supplement_advice": [
        "补充赤岗家家欣商场与合同虎门家家欣之间的地址/分店映射。"
      ]
    },
    {
      "store_line_no": 9,
      "contract_store_name": "花都宜多",
      "photo_files": [
        "9.花都宜多.jpg"
      ],
      "visible_date": "2026-04-30",
      "visible_location": "广东省广州市花都区炭步镇·炭步宜多百货",
      "period_match": "match",